[
 {
  "contract_id": "BM2",
  "clause_id": "C0",
  "question_id": "0.1",
  "status": "FOUND",
  "answer_value": "IIT Bombay (Office of Dean IPS) percentage rate tender on CPWD-7/8 form; Standard CPWD contract Form GCC 2020 as modified and corrected (as incorporated) by IITB",
  "unit": "",
  "base": "",
  "value_source": "schedule",
  "section_ref": "Schedule F, 9(ii)",
  "pdf_page": 106,
  "verbatim_quote": "Standard CPWD contract Form GCC 2020, CPWD Form 7/ 8 as modified & corrected upto AS INCORPORATED",
  "conflicts": [],
  "points_to": "",
  "visual_check": "none",
  "visual_evidence": "",
  "confidence": "high",
  "notes": "Institute NIT built on CPWD GCC 2020; percentage rate tender (CPWD-7 alternatives kept, item-rate CPWD-8 rules struck through). Bid due 27.04.2023."
 },
 {
  "contract_id": "BM2",
  "clause_id": "C0",
  "question_id": "0.2",
  "status": "FOUND",
  "answer_value": "Employer: Director, Indian Institute of Technology Bombay (Engineer-in-Charge: Dean IPS); Contractor: NOT_STATED (blank in tender form)",
  "unit": "",
  "base": "",
  "value_source": "clause",
  "section_ref": "Tender Form CPWD-7/8",
  "pdf_page": 4,
  "verbatim_quote": "I/We hereby tender for the execution of the work specified for the Director of Indian Institute of Technology , Bombay",
  "conflicts": [],
  "points_to": "",
  "visual_check": "none",
  "visual_evidence": "",
  "confidence": "high",
  "notes": "Contractor name and acceptance amount are blank in the package. Engineer-in-Charge = Dean IPS (Schedule F 2(v)); Accepting Authority = Director IITB/Dean IPS."
 },
 {
  "contract_id": "BM2",
  "clause_id": "C0",
  "question_id": "0.3",
  "status": "FOUND",
  "answer_value": "Estimated cost of work Rs. 2,12,27,336; tendered amount not stated (acceptance blank)",
  "unit": "INR",
  "base": "",
  "value_source": "schedule",
  "section_ref": "Schedule E",
  "pdf_page": 105,
  "verbatim_quote": "Estimated cost of work: Rs. ₹ 2,12,27,336/-",
  "conflicts": [],
  "points_to": "",
  "visual_check": "none",
  "visual_evidence": "",
  "confidence": "high",
  "notes": "Only the estimated cost is given; the accepted/tendered sum on the acceptance page is blank. EMD Rs. 4,24,547."
 },
 {
  "contract_id": "BM2",
  "clause_id": "C0",
  "question_id": "0.4",
  "status": "FOUND",
  "answer_value": "9 months (09 months, 0 to 9); date of start = 15 days from date of issue of letter of acceptance, or date of handing over of site, whichever is later",
  "unit": "months",
  "base": "",
  "value_source": "schedule",
  "section_ref": "Schedule F, Clause 5",
  "pdf_page": 107,
  "verbatim_quote": "TIME FOR ASSIGNMENT 09 (Nine) Months",
  "conflicts": [],
  "points_to": "",
  "visual_check": "none",
  "visual_evidence": "",
  "confidence": "medium",
  "notes": "Schedule F line 'Time allowed for execution of work....' (p108) is left blank; 9 months taken from the activity table headed 'Schedule in months from Date of award'. Start: Schedule F Clause 5 '15day' from letter of acceptance; Clause 5 and 2(xv): or site handover, whichever later."
 },
 {
  "contract_id": "BM2",
  "clause_id": "C0",
  "question_id": "0.5",
  "status": "FOUND",
  "answer_value": "12 months after certificate (final or otherwise) of completion (6 months only for works costing Rs. 10 lakh and below except road work, not this work); Clause 24 also: defects rectified minimum up to 1 year from completion",
  "unit": "months",
  "base": "",
  "value_source": "clause",
  "section_ref": "Clause 17",
  "pdf_page": 41,
  "verbatim_quote": "if any defect, shrinkage or other faults appear in the work within twelve months (six months in the case of work costing Rs. Ten lacs and below except road work)",
  "conflicts": [],
  "points_to": "",
  "visual_check": "none",
  "visual_evidence": "",
  "confidence": "high",
  "notes": "Estimated cost Rs 2.12 crore, so 12 months applies. Clause 24 (p49) repeats 1 year obligation to rectify defects."
 },
 {
  "contract_id": "BM2",
  "clause_id": "C0",
  "question_id": "0.6",
  "status": "FOUND",
  "answer_value": "Yes, activity periods only (no % of work or amounts): A shop drawings 1 month/30 days; B execution drawings 2 weeks/15 days; C+D project planning, procurement and construction 7 months total; E post-construction (as-built drawings, snag rectification) 2 weeks/15 days; total 9 months",
  "unit": "months",
  "base": "",
  "value_source": "schedule",
  "section_ref": "Schedule F, Clause 5 milestone table",
  "pdf_page": 107,
  "verbatim_quote": "Project Planning: Preparation/Submission of 07 (Seven) months",
  "conflicts": [],
  "points_to": "",
  "visual_check": "none",
  "visual_evidence": "",
  "confidence": "medium",
  "notes": "Milestone table gives durations only; no percentage of work, calendar dates or amounts against milestones (Clause 2 withholding refers to amounts shown against milestones, none shown). Table continues on p108."
 },
 {
  "contract_id": "BM2",
  "clause_id": "C1",
  "question_id": "1.1",
  "status": "FOUND",
  "answer_value": "Monthly interim/running account bills on recorded measurements (works over Rs 20 lakh), submitted on or before the date of every month fixed by Engineer-in-Charge; subject to minimum Rs 30 lakh gross work since last payment",
  "unit": "",
  "base": "",
  "value_source": "clause",
  "section_ref": "Clause 7",
  "pdf_page": 24,
  "verbatim_quote": "measurements on the format of the Department in triplicate on or before the date of every month fixed for the same by the Engineer-in-Charge.",
  "conflicts": [],
  "points_to": "",
  "visual_check": "none",
  "visual_evidence": "",
  "confidence": "high",
  "notes": "Interim advance payments at 75% of assessed value without detailed measurement are struck through on p25. Clause 7A: no RA bill paid until labour licences/EPFO/ESIC/BOCW registration submitted."
 },
 {
  "contract_id": "BM2",
  "clause_id": "C1",
  "question_id": "1.2",
  "status": "NOT_STATED",
  "answer_value": "No time limit for certification/measurement of bills stated",
  "unit": "",
  "base": "",
  "value_source": "",
  "section_ref": "",
  "pdf_page": 0,
  "verbatim_quote": "",
  "conflicts": [],
  "points_to": "",
  "visual_check": "none",
  "visual_evidence": "",
  "confidence": "medium",
  "notes": "Clause 7 only says E-in-C shall arrange to have the bill verified; no days. The printed 10/15 working day payment limit is struck through (see 1.3). Clause 12.2: rates for extra items within 45 days, not bill certification."
 },
 {
  "contract_id": "BM2",
  "clause_id": "C1",
  "question_id": "1.3",
  "status": "NOT_APPLICABLE",
  "answer_value": "Interim bills: payment time limit struck through, not part of contract (printed: by 10th working day after presentation of bill; 15 working days for works outside HQ). Final bill: see 1.7 (3 months for tendered value Rs 1-10 crore)",
  "unit": "working days",
  "base": "",
  "value_source": "clause",
  "section_ref": "Clause 7",
  "pdf_page": 25,
  "verbatim_quote": "The amount admissible shall be paid by 10th working day after the day of presentation of the bill by the Contractor to the Engineer-in-Charge or his Authorized Engineer",
  "conflicts": [],
  "points_to": "",
  "visual_check": "done",
  "visual_evidence": "Page 24 (marker 25) image shows the whole sentence block 'The amount admissible shall be paid by 10th working day ... compounded on yearly basis' struck through.",
  "confidence": "medium",
  "notes": "Struck text kept as printed terms only. No other interim payment period stated."
 },
 {
  "contract_id": "BM2",
  "clause_id": "C1",
  "question_id": "1.4",
  "status": "FOUND",
  "answer_value": "Yes, only for delayed final bill: simple interest 5% per annum, compounded yearly, from expiry of prescribed time limit, if final bill submitted in time and in order. Interim bill interest (5% p.a. after 45 days) is struck through",
  "unit": "% per annum",
  "base": "delayed final bill amount",
  "value_source": "clause",
  "section_ref": "Clause 9",
  "pdf_page": 26,
  "verbatim_quote": "a simple interest @ 5 % per annum shall be paid to the contractor from the date of expiry of prescribed time limit which will be compounded on yearly basis",
  "conflicts": [
   {
    "value": "5% p.a. on intermediate bills delayed beyond 45 days (struck through)",
    "section_ref": "Clause 7",
    "pdf_page": 25,
    "verbatim_quote": "simple interest @ 5% (five percent) per annum shall be paid to the contractor from the date of expiry of prescribed time limit",
    "governs": "Struck through, not part of contract; only Clause 9 final bill interest applies"
   }
  ],
  "points_to": "",
  "visual_check": "done",
  "visual_evidence": "Page 24 (marker 25) image: interim bill interest sentence struck through.",
  "confidence": "high",
  "notes": "Clause 29/29A: no interest on amounts withheld under lien; Clause 2: no interest on milestone withheld amounts."
 },
 {
  "contract_id": "BM2",
  "clause_id": "C1",
  "question_id": "1.5",
  "status": "FOUND",
  "answer_value": "Security deposit 5% of gross amount of each running and final bill (until 5% of tendered value); recovery of secured advance when materials incorporated; mobilisation advance recovery with 10% p.a. interest; compensation and other sums due (Cl 1A, 2); technical representative non-deployment recovery Rs 1,00,000/month (Sr. MEP) and Rs 60,000/month (others) per Schedule F Cl 32; penalties under Cl 19C/19D/19G; payments made to associate contractors recovered from next RA bill; GST/cess payable by contractor",
  "unit": "% of gross bill",
  "base": "gross amount of each running and final bill",
  "value_source": "clause",
  "section_ref": "Clause 1A",
  "pdf_page": 16,
  "verbatim_quote": "deduct a sum at the rate of 5 % of the gross amount of each running and final bill till the sum deducted will amount to security deposit of 5% of the tendered value of the work.",
  "conflicts": [],
  "points_to": "",
  "visual_check": "none",
  "visual_evidence": "",